Name,Status,Seller_Level,Location,Price,Stars,Ratings348B 2F5C para armazenamento de console Nintendo Switch Estojo Bolsa Para Transporte Bolso de Zíper Shell,Novo em folha,,De China,,-1,0
Decalque Adesivo De Mangá Design Para Nintendo Switch Console + Dois Controle Pele,Novo em folha,,De China,,-1,0
Peça De Reparo porta de carregamento tipo-C Tomada para Nintendo Switch console Ns,Novo em folha,Vendedor nível Top,De China,,-1,0
Vinil Stormtrooper Star Wars pele Nintendo Switch console Joy-Con Conjunto De Decalque Dock,Novo em folha,,De China,,-1,0
F274 D0B2 para Nintendo Switch console Película De Tela De Vidro Temperado Protetor De Hd 9H,Novo em folha,Vendedor nível Top,De Hong Kong,,F27,0
Cooler Ventilador de refrigeração Dock Base três ventiladores Dissipador De Calor Para Nintendo Switch Console,Novo em folha,Vendedor nível Top,De Hong Kong,,-1,0
Dock Station Base Suporte Portátil Estojo Para Console Nintendo Switch,Novo em folha,Vendedor nível Top,De China,,-1,0
Tipo-C Cabo De Extensão Cabo De Carregamento Usb Para Console Nintendo Switch Dock,Novo em folha,Vendedor nível Top,De China,,-1,0
Anti-slip Silicone Macio Azul Vermelho Pele Caso Para Nintendo Switch console Joy-Con,Novo (outro),Vendedor nível Top,De Hong Kong,,-1,0
Jogo De Slot 12 Cartão De Memória Suporte Caixa Estojo de armazenamento para Console Nintendo Switch,Novo em folha,Vendedor nível Top,De China,,-1,0
Tampa Traseira Dobrável Suporte Para Suporte De Suporte Para Console Nintendo Switch,Novo em folha,Vendedor nível Top,De China,,-1,0
Chave De Fenda 0.6Y 1.5+ Parafuso De Ferramentas De Reparo Para Console Nintendo Switch Alegria Con,Novo em folha,Vendedor nível Top,De China,,-1,0
Suporte Dobrável Play estação de carregamento Holder Suporte Para Nintendo Switch console Hot,Novo em folha,,De China,,-1,0
Controlador gamepad com fio Lidar Com Cabo Usb Para Console Nintendo Switch,Novo em folha,Vendedor nível Top,De China,,-1,0
Housse Étui Coque Protection Replacement Full Set Pour Nintendo Switch Console,Novo em folha,Vendedor nível Top,De Hong Kong,,-1,0
Babá: estilo Automata Pele De Vinil Adesivo Decalque Para Nintendo Switch console Joy-Con,Novo em folha,,De China,,-1,0
Lcd Touch Screen Digitalizador de substituição Do Painel Para Console Nintendo Switch,Novo em folha,Vendedor nível Top,De China,,-1,0
Terrário Estilo Pele De Adesivos Decalque Vinil Nintendo Switch console Joy-Con #1,Novo em folha,,De China,,-1,0
Suporte Dobrável Para Nintendo Switch Console E Tablets,Novo em folha,Vendedor nível Top,De Alemanha,,-1,0
DA52 Carcaça Inferior Superior de substituição Shell Para Nintendo Switch Console De Plástico,Novo em folha,Vendedor nível Top,De Hong Kong,,-1,0
Marvel Homem Aranha De Ferro Vinil pele Nintendo Switch console Joy-Con Adesivos,Novo em folha,Vendedor nível Top,De China,,-1,0
2964 Carcaça Inferior Superior de substituição Shell Para Nintendo Switch Console De Plástico,Novo em folha,Vendedor nível Top,De Hong Kong,,296,0
Sem fio controlador de jogo Gamepad Joystick Para Nintendo Switch Console Preto T6Z5,Novo em folha,Vendedor nível Top,De Hong Kong,,Wir,0
Air Jordan design Adesivos Decalque Vinil pele Nintendo Switch console Joy-Con #1,Novo em folha,,De China,,-1,0
03AB para Nintendo Switch console super Mario Adesivos Colante a Reutilizável,Novo em folha,Vendedor nível Top,De Hong Kong,,-1,0
"Estojo de transporte com zíper bolsa com alça para Nintendo Switch console Joy-con, Bl R9Y1",Novo em folha,Vendedor nível Top,De Hong Kong,,Zip,0
2E67 Carcaça Inferior Superior de substituição Shell Para Nintendo Switch Console De Plástico,Novo em folha,Vendedor nível Top,De Hong Kong,,2E6,0
Nintendo Switch console Joy-Con revestimento Adesivo Protetor De Capa #303 Zelda um F01,Novo em folha,,De Hong Kong,,-1,0
Darth Vader Star Wars Vinil pele Nintendo Switch console Joy-Con Conjunto De Decalque Dock,Novo em folha,,De China,,-1,0
Para Nintendo Switch Console Botão Slider externo com cabo flexível Peça De Reparo,Novo em folha,Vendedor nível Top,De China,,-1,0
Painel De Toque Tela Touch Pad Com Almofada De Esponja Para Console Nintendo Switch,Novo em folha,,De China,,-1,0
"Estojo de transporte com zíper bolsa com alça para Nintendo Switch console Joy-con, Bl W3K1",Novo em folha,Vendedor nível Top,De Hong Kong,,Zip,0
7FD7 Carcaça Inferior Superior de substituição Shell Para Nintendo Switch Console De Plástico,Novo em folha,Vendedor nível Top,De Hong Kong,,-1,0
Armazenamento portátil Saco Bolsa Capa Para Nintendo Switch console Joy W2S1,Novo em folha,Vendedor nível Top,De Hong Kong,,Por,0
Montagem para carro ajustável de viagem de encosto de cabeça titular suporte para Nintendo Switch Console,Novo em folha,Vendedor nível Top,De China,,-1,0
Frete Grátis Para Nintendo Switch Console Chave Switch Volume Cabo Flexível + Ferramentas kqfe 365,Novo em folha,Vendedor nível Top,De Hong Kong,,-1,0
"Estojo de transporte com zíper bolsa com alça para Nintendo Switch console Joy-con, Gr G4L4",Novo em folha,Vendedor nível Top,De Hong Kong,,Zip,0
Adesivo Skin De Vinil lovoski Decalque definido para Nintendo Switch Console e controlador,Novo em folha,Vendedor nível Top,De China,,-1,0
18AF Carcaça Inferior Superior de substituição Shell Para Nintendo Switch Console De Plástico,Novo em folha,Vendedor nível Top,De Hong Kong,,18A,0
Nintendo Switch console Joy-Con Adesivo Pele Capa um Pokemon #07 F01,Novo em folha,,De Hong Kong,,-1,0
24 Em 1 Jogo de titular de cartão de memória Case Box Organizador Para Nintendo Switch Console,Novo em folha,Vendedor nível Top,De Hong Kong,,-1,0
3E47 Carcaça Inferior Superior de substituição Shell Para Nintendo Switch Console De Plástico,Novo em folha,Vendedor nível Top,De Hong Kong,,3E4,0
250F Carcaça Inferior Superior de substituição Shell Para Nintendo Switch Console De Plástico,Novo em folha,Vendedor nível Top,De Hong Kong,,-1,0
Multicolorido Alumínio Hard Capa Protetora Escudo Protetor Para Console Nintendo Switch,Novo em folha,,De China,,-1,0
Frete Grátis Para Nintendo Switch Console Preto Estojo de Capa Carcaça Traseira + Ferramenta kqhs 739,Novo em folha,Vendedor nível Top,De Hong Kong,,-1,0
5A17 Carcaça Inferior Superior de substituição Shell Para Nintendo Switch Console De Plástico,Novo em folha,Vendedor nível Top,De Hong Kong,,-1,0
85D8 Carcaça Inferior Superior de substituição Shell Para Nintendo Switch Console De Plástico,Novo em folha,Vendedor nível Top,De Hong Kong,,85D,0
Dark Souls Decalque Adesivo De Pele Para Nintendo Switch Console E 2 Controles,Novo em folha,,De China,,-1,0
077B 5111 Para Console Nintendo Switch Película De Tela De Vidro Temperado Protetor De Hd 9H,Novo em folha,Vendedor nível Top,De Hong Kong,,077,0
Para Nintendo Switch console Joy-Con Vinil Revestimento adesivo Sword Art Online Tema,Novo em folha,Vendedor nível Top,De China,,-1,0
Star Wars Stormtrooper Vinil pele Nintendo Switch console Joy-Con Adesivos,Novo em folha,Vendedor nível Top,De China,,-1,0
Nintendo Switch console Joy-Con Adesivo Pele Capa #344 Pokemon Pikachu F01,Novo em folha,,De Hong Kong,,-1,0
Para Nintendo Switch console Gamepad lidar com Pele De Couro Pu Capa De Proteção,Novo em folha,Vendedor nível Top,De China,,-1,0
Alta taxa de-Carregador de carregamento doca Stand titular para Nintendo Switch console Joy-Con,Novo em folha,Vendedor nível Top,De China,,-1,0
1D3A Carcaça Inferior Superior de substituição Shell Para Nintendo Switch Console De Plástico,Novo em folha,Vendedor nível Top,De Hong Kong,,1D3,0
Capa Completa Protetora Capa TPU macia para Ns Nintendo Switch console W6H6,Novo em folha,Vendedor nível Top,De China,,-1,0
Cores diferents Capa Protetora De Silicone Para Jogos De Console Nintendo Switch Anti Slip,Novo em folha,,De China,,-1,0
Para Nintendo Switch Console Chave Switch Volume Cabo Flexível Peças De Reposição,Novo em folha,Vendedor nível Top,De China,,-1,0
Cooler Ventilador de refrigeração Dock Base três ventiladores Dissipador De Calor Para Nintendo Switch Console,Novo em folha,Vendedor nível Top,De China,,-1,0
Slot De Cartão De Jogo Soquete board fones de ouvido porta substituir por Nintendo Switch Console,Novo em folha,Vendedor nível Top,De Hong Kong,,-1,0
Nintendo Switch console Capa magnética híbrida 1501063,Novo (outro),,De Estados Unidos,"R$ 51,52",5.0,1
Suporte para carga de carregamento doca para Nintendo Switch Console/Pro Controller Lote H -,Novo em folha,,De Malásia,,-1,0
Para Nintendo Switch console Joy-Con Pele De Vinil Adesivo Decalque-Ataque no Titã,Novo em folha,Vendedor nível Top,De China,,-1,0
Capa Completa Protetora Capa TPU macia para Ns Nintendo Switch console H3Q1,Novo em folha,Vendedor nível Top,De China,,-1,0
Suporte Para Carro Banco Traseiro Suporte De Suporte Para Montagem De Encosto De Cabeça Para Console Nintendo Switch,Novo em folha,Vendedor nível Top,De China,,-1,0
2pcs Capa Protetora Transparente Rígido Escudo Protetor Para Console Nintendo Switch,Novo em folha,Vendedor nível Top,De China,,Pre,0
Substituição Protetora Para Nintendo Switch console Joy-con controlador,Novo em folha,Vendedor nível Top,De China,,-1,0
476A 2F9B para Nintendo Switch console Película De Tela De Vidro Temperado Protetor De Hd 9H,Novo em folha,Vendedor nível Top,De Hong Kong,,-1,0
Capa Completa Protetora Capa TPU macia para Ns Nintendo Switch console P5H2,Novo em folha,Vendedor nível Top,De China,,-1,0
Ventilador De Resfriamento Base Dock Stand Holder Suporte Para Nintendo Switch Console Novo #S,Novo em folha,Vendedor nível Top,De China,,-1,0
Carregador De Parede Para Console Nintendo Switch,Novo em folha,Vendedor nível Top,De Canadá,,-1,0
Para Nintendo Switch console Joy-Con Pele Vinil Adesivos Terrário Skin #1,Novo em folha,,De China,,-1,0
Controlador sem fio de qualidade Joypad Gamepad Controle Remoto Para Nintendo Switch Console,Novo em folha,Vendedor nível Top,De China,,-1,0
Capa Protetor De Tela Para Nintendo Switch console Fosca Anti-reflexo Filme,Novo em folha,Vendedor nível Top,De China,,-1,0
Capa Completa Protetora Capa TPU macia para Ns Nintendo Switch console M6U3,Novo em folha,Vendedor nível Top,De China,,-1,0
Pacote com 1 Peças De Reposição Direito Controle Deslizante Cabo Flexível Para Console Nintendo Switch,Novo em folha,Vendedor nível Top,De China,,-1,0
Super Mario Odyssey Nintendo Switch console Joy-Con decalques de vinil da pele da pele #2,Novo em folha,,De China,,-1,0
Super Mario Odyssey Nintendo Switch console Joy-Con decalques de vinil da pele da pele #10,Novo em folha,,De China,,-1,0
Super Mario Odyssey Nintendo Switch console Joy-Con decalques de vinil da pele da pele #13,Novo em folha,,De China,,-1,0
Super Mario Odyssey Nintendo Switch console Joy-Con decalques de vinil da pele da pele #4,Novo em folha,,De China,,-1,0
1 Par Kit faça você mesmo consertar built-in Alto-falante Alto-falante Para Nintendo Switch Console,Novo em folha,Vendedor nível Top,De China,,-1,0
Para Nintendo Switch Console Usado Preto De Volta Carcaça Traseira E Suporte unidade fvmb 077,Seminovo,Vendedor nível Top,De Hong Kong,,-1,0
Ref.: Zero − começando a vida em outro mundo pele Nintendo Switch console Joy-Con,Novo em folha,,De China,,-1,0
One Piece Adesivos Decalque Vinil estilo pele Nintendo Switch console Joy-Con #3,Novo em folha,,De China,,-1,0
F7F9 Carcaça Inferior Superior de substituição Shell Para Nintendo Switch Console De Plástico,Novo em folha,Vendedor nível Top,De Hong Kong,,-1,0
564C Carcaça Inferior Superior de substituição Shell Para Nintendo Switch Console De Plástico,Novo em folha,Vendedor nível Top,De Hong Kong,,-1,0
Anti-scratch Case Rígido Capa Protetor Transparente Para Console Nintendo Switch,Novo em folha,Vendedor nível Top,De Hong Kong,,Ant,0
Conjunto de Estojo de estrutura de substituição para Console Nintendo Switch Joy-con controlador,Novo em folha,Vendedor nível Top,De China,,-1,0
"Estojo de transporte com zíper bolsa com alça para Nintendo Switch console Joy-con, Re S5L6",Novo em folha,Vendedor nível Top,De Hong Kong,,Zip,0
Estação de carregamento Estação Base Suporte Com Cabo De Carregamento Para Console Nintendo Switch,Novo em folha,Vendedor nível Top,De China,,-1,0
Slot De Cartão De Jogo Soquete board fones de ouvido porta substituir por Nintendo Switch Console,Novo em folha,Vendedor nível Top,De China,,-1,0
Bolsa de zíper Portátil Maleta Alça Para Nintendo Switch console & Joy-Con,Novo em folha,Vendedor nível Top,De Hong Kong,,-1,0
Decalque de PVC elegante revestimento Adesivo Protetor De Poeira Para Console Nintendo Switch,Novo em folha,Vendedor nível Top,De Hong Kong,,-1,0
Adesivo Jogo De Gwent Challenger Para Console Nintendo Switch Decalque lidar com Skin #10,Novo em folha,,De China,,-1,0
1.8m Com Fio Usb Controlador De Jogo Para Console Nintendo Switch Joystick Gamepad,Novo em folha,Vendedor nível Top,De China,,-1,0
Estojo Macio Preto Manga Capa Bolsa Saco armazenamento Para Console Nintendo Switch,Novo em folha,Vendedor nível Top,De China,,-1,0
Para Nintendo Switch Console Botão Externo R Slider Peças Reparo Cabo Flexível,Novo em folha,Vendedor nível Top,De China,,-1,0
Estação de arrefecimento SH500 Titular da estação de carregamento com PCB para Nintendo Switch Console,Novo em folha,,De China,,-1,0
Para Nintendo Switch console 2017 * Cpu Ventilador de refrigeração Dissipador De Calor Reparo parte fvot 777,Novo em folha,Vendedor nível Top,De Hong Kong,,-1,0
Capa Protetora de Silicone durável Para Console Nintendo Switch Joy-con controlador,Novo em folha,Vendedor nível Top,De China,,-1,0
2x Para Console Nintendo Switch Touch Screen Moldura Adesivo Fita fvrt 172,Novo em folha,Vendedor nível Top,De Hong Kong,,-1,0
Jogo de slots de 4 Cartão De Memória Suporte Caixa Estojo de armazenamento para Console Nintendo Switch,Novo em folha,Vendedor nível Top,De China,,-1,0
Carcaça Fundo Superior de substituição Shell Para Nintendo Switch Console De Plástico,Novo em folha,,De China,,-1,0
Mini Dock De Arrefecimento Portátil Estação Base de Suporte para Nintendo Switch console E0Xc,Novo em folha,Vendedor nível Top,De China,,Pre,0
Suporte para carga de carregamento doca para Nintendo Switch Console/PRO controlador Lote Mu,Novo em folha,,De Malásia,,-1,0
Portas Duplas estação de carregamento doca de carregamento Suporte Para Nintendo Switch Console Novo,Novo em folha,Vendedor nível Top,De China,,Pre,0
Decalque Adesivo elegante design para Nintendo Switch Console + Dois Controle Pele,Novo em folha,,De China,,-1,0
Para Nintendo Switch console Cooler Dissipador De Calor reparo substituição parte Nova,Novo em folha,Vendedor nível Top,De China,,-1,0
Slim Eva Hard Capa Protetora Para Viagem Saco Para Nintendo Switch Console E Acessórios,Novo em folha,Vendedor nível Top,De China,,-1,0
Cooler Ventilador de refrigeração Dock Base três ventiladores Dissipador De Calor Para Nintendo Switch Console,Novo em folha,Vendedor nível Top,De Hong Kong,,-1,0
10x Para Console Nintendo Switch Touch Screen Moldura Adesivo Fita fvrt 172,Novo em folha,Vendedor nível Top,De Hong Kong,,-1,0
Para Nintendo Switch console estação de carregamento tipo de porta-C Soquete Reparo parte fvmb 028,Novo em folha,Vendedor nível Top,De Hong Kong,,-1,0
Frete Grátis Para Nintendo Switch Console Usado Preto Estilo Traseiro + Ferramentas zjmb 077,Novo (outro),Vendedor nível Top,De Hong Kong,,-1,0
Para Nintendo Switch Console Esquerdo + Direito Controle deslizante com cabo flexível Peça De Reparo fvot 808,Novo em folha,Vendedor nível Top,De Hong Kong,,-1,0
Substituição Lcd Touch Screen Display Digitalizador Para Nintendo Switch Console,Novo em folha,Vendedor nível Top,De China,,-1,0
Suporte Para Carro Banco Traseiro Suporte De Suporte Para Montagem De Encosto De Cabeça Para Console Nintendo Switch,Novo em folha,Vendedor nível Top,De Hong Kong,,-1,0
Hatsune Miku Adesivo Jogo Para Console Nintendo Switch Controlador De Decalque Skin #8,Novo em folha,,De China,,-1,0
Substituição 42DF ceaa Top Carcaça Inferior Preto Concha Para Console Nintendo Switch,Novo em folha,Vendedor nível Top,De Hong Kong,,-1,0
Legend Zelda Para Nintendo Switch console pele Vinyl Decal Adesivo Controlador,Novo em folha,,De China,,-1,0
Capa Rígida Transparente Anti-scratch Escudo Protetor Para Console Nintendo Switch,Novo em folha,Vendedor nível Top,De Hong Kong,,Pre,0
Sem fio controlador de jogo Gamepad Joystick Para Nintendo Switch Console Preto I8C2,Novo em folha,,De Hong Kong,,Wir,0
6F36 para Nintendo Switch console super Mario Adesivos Colante a Reutilizável,Novo em folha,Vendedor nível Top,De Hong Kong,,-1,0
Suporte para carga de carregamento doca para Nintendo Switch Console/Pro Controller Lote Ga,Novo em folha,Vendedor nível Top,De Malásia,,-1,0
Super Mario Odyssey Nintendo Switch console Joy-Con decalques de vinil da pele da pele #11,Novo em folha,,De China,,-1,0
Hatsune Miku Adesivo Para Nintendo Switch console Decalque Jon-com decalques de pele #10,Novo em folha,,De China,,-1,0
Para Nintendo Switch Console Chave Switch Volume Cabo De Fita Flex de substituição,Novo em folha,Vendedor nível Top,De China,,-1,0
FREE SHIP for Nintendo Switch Console USED Black Rear KickStand + Tools ZVMB077,Seminovo,Vendedor nível Top,De Hong Kong,,-1,0
Protetores De Caixa 5 X Para Console Nintendo Switch Forte 0.5mm estojo de exibição de plástico,Novo em folha,Vendedor nível Top,De Reino Unido,,-1,0
Hatsune Miku Adesivo Jogo Para Console Nintendo Switch Controlador De Decalque Skin #3,Novo em folha,,De China,,-1,0
Hatsune Miku Adesivo Tema Para Console Nintendo Switch Controlador De Decalque Skin #8,Novo em folha,,De China,,-1,0
Top Games splatoon 2 thmem decalques para Nintendo Switch console revestimento Adesivo De Vinil,Novo em folha,,De China,,-1,0
Substituição De Tela De Toque Original Para Console Nintendo Switch Tela LCD retroiluminado,Novo em folha,Vendedor nível Top,De Hong Kong,,Pre,0
Pele De Vinil Para Nintendo Switch (console Joy Con Interruptor Dock Joy-Con Grip) #4,Novo em folha,Vendedor nível Top,De China,,-1,0
Kmd Nintendo Switch Estojo De Transporte Console,Novo em folha,Vendedor nível Top,De Estados Unidos,"R$ 75,10",-1,0
PS4-Oficial Arsenal FC-Nintendo Switch (Console E Controle (importado Uk) Jogo Novo,Novo em folha,Vendedor nível Top,De Reino Unido,,-1,0
Dock Station E Carregador Para Nintendo Console Switch Grande Suporte charget,Novo em folha,Vendedor nível Top,De China,,Pre,0
Nintendo Switch console pele Hatsune Miku design Adesivos e decalques Jon-Con Skin #10,Novo em folha,,De China,,-1,0
FREE SHIP für Nintendo Switch Console Schwarz Rück Gehäuse Hülle + Tools ZVHS739,Novo em folha,Vendedor nível Top,De Hong Kong,,-1,0
Para Nintendo Switch console Gamepad Jogo caso Decalques Adesivo Conjunto limpo,Novo em folha,,De Hong Kong,,-1,0
Nintendo Switch console Joy-Con Adesivo Pele Capa #02 Zelda um F01,Novo em folha,,De Hong Kong,,-1,0
Para Nintendo Switch console Pele De Vinil Adesivo Decalque De Gwent Challenger Style,Novo em folha,Vendedor nível Top,De China,,-1,0
24 Em 1 Porta-cartão De Memória Estojo de Capa Cartão De Jogo Para Console Nintendo Switch,Novo em folha,Vendedor nível Top,De China,,-1,0
Hatsune Miku Adesivo Jogo Para Console Nintendo Switch Controlador De Decalque Skin #7,Novo em folha,,De China,,-1,0
Para Nintendo Switch Console Botão Externo R Controle Deslizante cabo flexível parte de reparação,Novo em folha,Vendedor nível Top,De China,,-1,0
Para Nintendo Switch Console Top Som Volume com cabo flexível Botão Interruptor fvfe 365,Novo em folha,Vendedor nível Top,De Hong Kong,,-1,0
Placa De Rede Host Nic Chip Reparo Peças para Nintendo Switch console Joy-Con,Novo em folha,Vendedor nível Top,De China,,-1,0
Vinil Estilo Peça One Adesivos pele Nintendo Switch console Joy-Con #1,Novo em folha,,De China,,-1,0
Para Nintendo Switch console Joy-Con Skin Adesivos Decalque Vinil splatoon 2 Skin #5,Novo em folha,,De China,,-1,0
"Zero Kara hajimeru Isekai Vinil, Capa Fo Nintendo Switch console Adesivo #5",Novo em folha,,De China,,-1,0
8B63 Carcaça Inferior Superior de substituição Preto Concha Para Console Nintendo Switch,Novo em folha,Vendedor nível Top,De China,,-1,0
Tela De Abs Transparente Película Protetora Guarda Capa Completa Para Console Nintendo Switch,Novo (outro),Vendedor nível Top,De China,,Pre,0
Slot de cartão de jogo Módulo Board Com Porta Fones De Ouvido Para Console Nintendo Switch,Novo em folha,Vendedor nível Top,De China,,-1,0
Faixa De Prata Estilo Pele De Adesivos Decalque Vinil Nintendo Switch console Joy-Con,Novo em folha,,De China,,-1,0
D2AD 4F48 Game Player Brinquedo De Madeira-Con Suporte Para Nintendo Switch Console,Novo em folha,Vendedor nível Top,De Hong Kong,,D2A,0
10000mAh caso de carga da bateria carregador de backup para Console Nintendo Switch,Novo em folha,Vendedor nível Top,De China,,-1,0
032D Carcaça Inferior Superior de substituição Shell Para Nintendo Switch Console De Plástico,Novo em folha,Vendedor nível Top,De Hong Kong,,032,0
Usb tipo-C-C para saída de vídeo Hdmi Hdtv Cabo Adaptador Para Console Nintendo Switch,Novo em folha,Vendedor nível Top,De China,,-1,0
Ventiladores de resfriamento 3 Base Dock Stand Holder Suporte Para Nintendo Switch Console Preto,Novo em folha,Vendedor nível Top,De China,,-1,0
"Zero Kara hajimeru Isekai Vinil, Capa Nintendo Switch console Adesivo #2",Novo em folha,,De China,,-1,0
Hatsune Miku Adesivo Jogo Para Console Nintendo Switch Controlador De Decalque Skin #6,Novo em folha,,De China,,-1,0
Banco Traseiro Carro ajustável encosto de cabeça Suporte de Montagem Suporte Para Console Nintendo Switch,Novo em folha,Vendedor nível Top,De China,,-1,0
Carcaça Fundo Superior de substituição Capa Preto Para Console Nintendo Switch,Novo em folha,Vendedor nível Top,De Hong Kong,,-1,0
Dock E Carregador Extensor Cabo De Transferência De 10 Gbps Para Console Nintendo Switch,Novo em folha,Vendedor nível Top,De China,,-1,0
"Zero Kara hajimeru Isekai Vinil, Capa Nintendo Switch console Adesivo #1",Novo em folha,,De China,,-1,0
für Nintendo Switch Console USED Schwarz Rück / Rear Gehäuse Kick Stand ZVMB077,Seminovo,Vendedor nível Top,De Hong Kong,,-1,0
Anti-slip Silicone Capa Case Kit Para Nintendo Switch console joysticks,Novo em folha,,De China,,-1,0
Multi-cor de pele de Vinil Adesivo Decalque Para controladores Nintendo Switch Console,Novo em folha,Vendedor nível Top,De China,,-1,0
Display Lcd Touch Screen Digitalizador Monitor Peças para Nintendo Switch Console,Novo em folha,Vendedor nível Top,De China,,-1,0
12 Cartões de Jogo Caça-níqueis Caixa Estojo de armazenamento para Console Nintendo Switch,Novo em folha,Vendedor nível Top,De China,,-1,0
Hard Capa Portátil Para Viagem com zíper bolsa de armazenamento para Console Nintendo Switch,Novo em folha,Vendedor nível Top,De Reino Unido,,-1,0
Adesivo Jogo Gwent Challenger Para Console Nintendo Switch Decalque lidar com Skin #3,Novo em folha,,De China,,-1,0
Adesivo Jogo De Gwent Challenger Para Console Nintendo Switch Decalque lidar com Skin #2,Novo em folha,,De China,,-1,0
Para Nintendo Switch console Radiador Refrigerador Dissipador De Calor Peças De Reposição,Novo em folha,Vendedor nível Top,De China,,-1,0
Adesivo Jogo Gwent Challenger Para Console Nintendo Switch Decalque lidar com Skin #4,Novo em folha,,De China,,-1,0
"Sword Art Online Jogo para console Nintendo Switch Decalque Adesivo De Vinil, Capa",Novo em folha,,De China,,-1,0
Suporte Dobrável Para Nintendo Switch Console E Tablets,Novo em folha,,De Alemanha,,-1,0
Para substituição de Nintendo Switch Console * Preto Painel Traseiro De caso fvhs 739,Novo em folha,Vendedor nível Top,De Hong Kong,,-1,0
Para Nintendo Switch console Cooler Dissipador De Calor reparo substituição parte,Novo em folha,Vendedor nível Top,De China,,-1,0
Hatsune Miku Adesivo Jogo Para Console Nintendo Switch Controlador De Decalque Skin #1,Novo em folha,,De China,,-1,0
Suporte Dobrável Para Nintendo Switch Console E Tablets,Novo em folha,,De Alemanha,,-1,0
Para Nintendo Switch Console Porta de carregamento Hdmi Reparo De Placa-mãe parte fvot 811,Novo em folha,Vendedor nível Top,De Hong Kong,,-1,0
Display Lcd Touch Screen Digitalizador Monitor parte para Nintendo Switch Console,Novo em folha,Vendedor nível Top,De China,,-1,0
Jogo portátil Altura Ajustável Suporte Para Suporte De Console Nintendo Switch,Novo em folha,Vendedor nível Top,De China,,Pre,0
Estilo Clássico Adesivos Vinil pele Nintendo Switch console Joy-Con #2,Novo em folha,,De China,,-1,0
Substituição do Painel Frontal Superior E Inferior Carcaça Capa para console Nintendo Switch,Novo em folha,Vendedor nível Top,De Hong Kong,,-1,0
Para Console Nintendo Switch jogo Gamepad Super Mario Adesivos reutilizáveis,Novo em folha,Vendedor nível Top,De China,,-1,0
Tampa de Estojo de transporte de Viagem Bolsa Para Nintendo Switch Console E Acessórios,Novo em folha,Vendedor nível Top,De China,,-1,0
Direito Esquerdo L/R Controle Deslizante Com Reparo Cabo Flexível Para Console Nintendo Switch,Novo em folha,Vendedor nível Top,De China,,-1,0
Em Promoção decalque adesivo de pele Protetor De Pvc De Poeira Para Console Nintendo Switch,Novo em folha,Vendedor nível Top,De Hong Kong,,-1,0
Disco De Proteção Viagem Bolsa Capa De Transporte Para Console Nintendo Switch Jogo,Novo em folha,,De Reino Unido,,Pre,0
Adesivo Skin De Vinil magideal Decalque Para Nintendo Switch console Joy-Con Dock,Novo em folha,Vendedor nível Top,De China,,-1,0
