Name,Status,Seller_Level,Location,Price,Stars,Ratings
Nintendo Switch console Joy-Con L/R Cinza frete EMS do Japão Novo,Novo em folha,Vendedor nível Top,De Japão,,-1,0
Novo em folha e lacrado Nintendo Switch Console Com Neon Vermelho/Azul Neon Joy-Con,Novo em folha,,De Estados Unidos,"R$ 1 001,93",Tem,0
Novo EM FOLHA CONSOLE Nintendo Switch 32GB Vermelho Joy Cons & Super Mario Odyssey Pacote,Novo em folha,,De Estados Unidos,"R$ 1 991,21",5.0,39
Nintendo Switch Console (5.1.0) (Leia A Descrição),Seminovo,,De Porto Rico,,Tem,0
Nintendo Switch console 32GB splatoon Bundle 2 Verde Neon Rosa Alegria Con Novíssimo,Novo em folha,,De Estados Unidos,"R$ 2 504,82",-1,0
Envio INTERNACIONAL! - Nintendo Switch Console Com Neon Azul E Vermelho Joy-Con,Novo em folha,,De Estados Unidos,"R$ 1 878,62",-1,0
Novo Sistema Console Nintendo Switch Monster Hunter Xx Double Cross Especial Pack,Novo em folha,Vendedor nível Top,De Japão,,5.0,5
"Nintendo Switch Console Com Cinza Joy-con, Super Mario Odyssey, Pro Controller",Novo em folha,Vendedor nível Top,De Estados Unidos,"R$ 1 920,36",5.0,92
Console Nintendo Switch splatoon 2 HAC-s-kacek,Novo em folha,,De Japão,,4.5,88
Novo Custom Clara azul atômica Nintendo Switch console & joycons (sistema Completo),Novo em folha,,De Estados Unidos,"R$ 1 753,33",-1,0
Nintendo Switch Console Com Cinza Joy-Con,Seminovo,,De Estados Unidos,"R$ 2 379,54",4.5,88
Novo Custom Clara Clara Nintendo Switch console & joycons (sistema Completo),Novo em folha,,De Estados Unidos,"R$ 1 753,33",-1,0
Nintendo Switch Console Com Neon Red & Blue joycon + Mario Kart 8 Deluxe + mais,Seminovo,,De Canadá,,Tem,0
Nintendo Switch Console Com Cinza Joy-con E Pacote Com Controle Pro,Novo em folha,,De Estados Unidos,"R$ 1 502,89",-1,0
"Nintendo Switch Console Com Neon Joy-con, Super Mario Odyssey, Pro Controller",Novo em folha,Vendedor nível Top,De Estados Unidos,"R$ 1 920,36",4.5,88
Nintendo Switch Console Com Neon Azul/Vermelho Joy-Con,Seminovo,,De Estados Unidos,"R$ 2 379,54",-1,0
Nintendo Switch Neon Console Novo!!!,Novo em folha,Vendedor nível Top,De Austrália,,5.0,74
"Nintendo Switch Console Com Neon Azul Vermelho Joy-con, hacskabaa",Novo em folha,,De Estados Unidos,"R$ 1 644,12",-1,0
Novo Custom White Nintendo Switch console & joycons (sistema Completo),Novo em folha,Vendedor nível Top,De Estados Unidos,"R$ 1 753,17",-1,0
Novo Custom Clara Atomic Verde Nintendo Switch console & joycons (sistema Completo),Novo em folha,,De Estados Unidos,"R$ 1 753,33",-1,0
Nintendo Switch console 32GB Super Mario Edição Odyssey Vermelho Pacote Novo em folha,Novo em folha,Vendedor nível Top,De Estados Unidos,"R$ 2 295,88",-1,0
Nintendo Switch Console-Neon Vermelho Azul joycon 32GB 2-3 dias envio prioritário! Novo Na Caixa,Novo em folha,,De Estados Unidos,"R$ 1 486,15",-1,0
Novo em folha Nintendo Switch Console E Jogo Kirby Star aliados do JAPÃO F/S,Novo em folha,,De Japão,,5.0,1085
Nintendo Switch Somente Console-Tablet-Leia A Descrição inclui Garantia Novo,Novo em folha,Vendedor nível Top,De Estados Unidos,"R$ 939,31",-1,0
Nintendo Switch Cinza Console Novo!!!,Novo em folha,Vendedor nível Top,De Austrália,,5.0,30
Nintendo Switch console Neon + Mario Kart 8 Deluxe pacote * novo * ＋ Garantia!!!,Novo em folha,Vendedor nível Top,De Austrália,,-1,0
Grey Nintendo Switch Console + Vidro Temperado + Zelda botw + 2 X Joy-Con Controle,Novo em folha,Vendedor nível Top,De Austrália,,-1,0
Novo Console Nintendo Switch Com Cinza Joy-Con,Novo em folha,,De Estados Unidos,"R$ 1 456,97",5.0,1085
Nintendo Switch Somente Console-Tablet-inclui Garantia Por Favor Leia A Descrição,Novo em folha,,De Estados Unidos,"R$ 939,06",-1,0
Nintendo Switch Console Cinza + Mario Kart 8 Deluxe pacote * novo * ＋ Garantia!!!,Novo em folha,Vendedor nível Top,De Austrália,,-1,0
Nintendo Switch Console-Neon Vermelho E Azul Neon 2500166,Novo em folha,Vendedor nível Top,De Itália,,-1,0
Nintendo Switch console Mario Odyssey Edition MEGA Pacote.... Relógio MUST,Novo (outro),,De Estados Unidos,"R$ 8 349,41",-1,0
Somente Console Nintendo Switch,Seminovo,,De Reino Unido,,-1,0
Nintendo Switch Console Com Neon Red & Blue Joy-Con novo jogo da UE,Novo em folha,Vendedor nível Top,De Reino Unido,,-1,0
Nintendo Switch Console Com Neon Azul E Vermelho Neon joycon Cinza Alegria Pacote Mario,Novo em folha,,De Estados Unidos,"R$ 1 747,53",5.0,1085
Novo Custom Clara Atomic Verde Nintendo Switch console & joycons (sistema Completo),Novo em folha,Vendedor nível Top,De Estados Unidos,"R$ 1 753,17",-1,0
Novo Custom Clara Atomic Purple Nintendo Switch console & joycons (sistema Completo),Novo em folha,Vendedor nível Top,De Estados Unidos,"R$ 1 753,17",-1,0
Nintendo Switch Console Com Cinza Joy-Con UE Jogo Novo,Novo em folha,Vendedor nível Top,De Reino Unido,,5.0,5
Nintendo Switch Console Com splatoon 2 + Neon Verde E Rosa Joy-Cons [ns 32GB],Novo em folha,Vendedor nível Top,De Estados Unidos,"R$ 2 296,04",-1,0
Console Switch Nintendo Cinza,Novo em folha,,De Estados Unidos,"R$ 2 087,35",-1,0
Nintendo Switch Console Super Mario Edição Odyssey Com 2 Joy-Cons [ns 32GB] Novo,Novo em folha,Vendedor nível Top,De Estados Unidos,"R$ 3 339,72",5.0,39
"Console Nintendo Switch, Joy Con, multiplayer, sistema de Home Video Game, Portátil",Novo em folha,,De Estados Unidos,"R$ 2 692,64",-1,0
Microsoft XBOX ONE (edição Day One) Console 500GB Com Kinect-Lacrado Novo,Novo em folha,,De Estados Unidos,"R$ 1 711,54",-1,0
NINTENDO SWITCH CONSOLE WITH NEON RED & BLUE JOY-CON EU GAME NEUF,Novo em folha,Vendedor nível Top,De Reino Unido,,NIN,0
Sistema console Nintendo Switch Super Mario Odyssey Conjunto Jogo Importado Do Japão,Novo em folha,Vendedor nível Top,De Japão,,5.0,1
Zelda Sheikah Ardósia Saco Para Nintendo Switch Capa Protetor De Console,Novo em folha,Vendedor nível Top,De China,,Pre,0
Nintendo Switch console & Kirby & Joy controlador Pacote Conjunto Do Japão,Novo em folha,,De Japão,,-1,0
Nintendo Switch Somente Console-Tablet-Novo em Folha + Cartão Sandisk 128gb microSDXC,Novo em folha,,De Estados Unidos,"R$ 1 127,17",-1,0
8 Em 1 Jogo de titular de cartão de memória Case Box Organizador Para Nintendo Switch Console,Novo em folha,Vendedor nível Top,De China,,-1,0
Novo em Folha Na Caixa Nintendo Switch Console Cinza Joy-Con Em Mãos! pronto Para Frete!,Novo em folha,,De Estados Unidos,"R$ 1 665,71",-1,0
"Nintendo Switch Console Com Neon Azul Vermelho Joy-con, hacskabaa",Novo em folha,,De Estados Unidos,"R$ 1 858,41",-1,0
Nintendo Switch Console Com Cinza Joy-Con + Zelda botw + Estojo Rígido + Tela De Vidro,Novo em folha,,De Estados Unidos,"R$ 1 669,84",5.0,5
Pacote Console Nintendo Switch Dia de Lançamento Versão 4 hacking (Envio no mesmo dia!),Novo em folha,,De Estados Unidos,"R$ 2 922,29",-1,0
Nintendo Switch Console Super Bundle 32GB Cinza,Novo em folha,,De Coreia do Sul,,-1,0
Nintendo Switch Console Com Neon Vermelho E Azul Joy-Controlador [Versão Japonesa],Novo em folha,Vendedor nível Top,De Japão,,-1,0
Genuine Nintendo Switch Console Preto Au Versão Na Caixa,Seminovo,Vendedor nível Top,De Austrália,,-1,0
Para Nintendo Switch console Joy-Con desmontar Tri-Wing Jogo De Chaves De Fenda,Novo em folha,Vendedor nível Top,De China,,-1,0
Console Game Nintendo Switch Estojo de transporte de Viagem Bolsa De Armazenamento De Proteção Capa,Novo em folha,Vendedor nível Top,De China,,-1,0
Cabo controlador gamepad com fio Botão De Cabo Usb Para Console Nintendo Switch,Novo em folha,,De Hong Kong,,-1,0
Nintendo Switch console Joy-Con pele Monster Hunter Skin Adesivo Decalque #11,Novo em folha,,De China,,-1,0
Novo Custom Clara Nintendo Switch console & joycons (sistema Completo),Novo em folha,Vendedor nível Top,De Estados Unidos,"R$ 1 753,17",-1,0
Novo Custom Clara azul atômica Nintendo Switch console & joycons (sistema Completo),Novo em folha,Vendedor nível Top,De Estados Unidos,"R$ 1 753,17",-1,0
"Nintendo Switch console Vermelho/Azul Joy-Con com caixa, fones de ouvido, Joy-Con Shield & Tela",Novo em folha,,De Estados Unidos,"R$ 1 628,09",-1,0
D190 controlador gamepad com fio 0927 botão Cabo Usb Para Console Nintendo Switch,Novo em folha,Vendedor nível Top,De Hong Kong,,-1,0
0967 410E com fio controlador gamepad lidar com botão Usb Para Console Nintendo Switch,Novo em folha,Vendedor nível Top,De Hong Kong,,-1,0
63BE 076A com fio controlador gamepad lidar com botão Usb Para Console Nintendo Switch,Novo em folha,Vendedor nível Top,De Hong Kong,,-1,0
Adesivo Película removível Skin Wrap Capa Para Nintendo Switch Console + Controles,Novo em folha,Vendedor nível Top,De Reino Unido,,-1,0
4FCF controlador gamepad com fio 0737 botão Cabo Usb Para Console Nintendo Switch,Novo em folha,,De China,,-1,0
E5D0 FE1D com fio controlador gamepad lidar com botão Usb Para Console Nintendo Switch,Novo em folha,Vendedor nível Top,De Hong Kong,,-1,0
Controle Com Fio E73A 3076 Gamepad lidar com botão Usb Para Console Nintendo Switch,Novo em folha,,De China,,-1,0
Nintendo Switch Console Com Cinza Joy-Con UE (importado Uk) Jogo Novo,Novo em folha,Vendedor nível Top,De Reino Unido,,-1,0
Ns Monster Hunter Xx todos em uma Caixa De Transporte Para Console Nintendo Switch (japonês),Novo em folha,Vendedor nível Top,De Hong Kong,,-1,0
842E A52B com fio controlador gamepad lidar com botão Usb Para Console Nintendo Switch,Novo em folha,,De China,,-1,0
F437 53A2 com fio controlador gamepad lidar com botão Usb Para Console Nintendo Switch,Novo em folha,Vendedor nível Top,De Hong Kong,,-1,0
BF70 358A com fio controlador gamepad lidar com botão Usb Para Console Nintendo Switch,Novo em folha,Vendedor nível Top,De Hong Kong,,-1,0
Verre Trempé Film Protection écran Protège Feuille pour Nintendo SWITCH CONSOLE,Novo em folha,Vendedor nível Top,De China,,-1,0
5AC4 B49E com fio controlador gamepad lidar com botão Usb Para Console Nintendo Switch,Novo em folha,,De China,,-1,0
Tema De Jogos Padrão De Proteção Capa Dura Para Console Nintendo Switch,Novo em folha,Vendedor nível Top,De China,,-1,0
4D2B 36C2 com fio controlador gamepad lidar com botão Usb Para Console Nintendo Switch,Novo em folha,,De China,,-1,0
08F3 5C0C com fio controlador gamepad lidar com botão Usb Para Console Nintendo Switch,Novo em folha,Vendedor nível Top,De Hong Kong,,-1,0
C23C 8BE8 com fio controlador gamepad lidar com botão Usb Para Console Nintendo Switch,Novo em folha,,De China,,-1,0
2FEE controlador gamepad com fio 3376 botão Cabo Usb Para Console Nintendo Switch,Novo em folha,,De China,,-1,0
026D controlador gamepad com fio DD37 lidar com botão Usb Para Console Nintendo Switch,Novo em folha,,De China,,-1,0
BE37 4A86 com fio controlador gamepad lidar com botão Usb Para Console Nintendo Switch,Novo em folha,,De China,,-1,0
2192 9A7E com fio controlador gamepad lidar com botão Usb Para Console Nintendo Switch,Novo em folha,,De China,,-1,0
338B E8B5 com fio controlador gamepad lidar com botão Usb Para Console Nintendo Switch,Novo em folha,,De China,,-1,0
6672 3C25 com fio controlador gamepad lidar com botão Usb Para Console Nintendo Switch,Novo em folha,,De China,,-1,0
Novo LAN com fio Adaptador Placa De Rede Interna Para Console Nintendo Switch,Novo em folha,Vendedor nível Top,De Hong Kong,,-1,0
8400 34DF com fio controlador gamepad lidar com botão Usb Para Console Nintendo Switch,Novo em folha,Vendedor nível Top,De Hong Kong,,-1,0
"Novo, tudo em um saco de transporte Bolsa Estojo Para Console Nintendo Switch (Japão) Hori",Novo em folha,Vendedor nível Top,De Hong Kong,,-1,0
Controle Com Fio 55D0 0530 Gamepad lidar com botão Usb Para Console Nintendo Switch,Novo em folha,Vendedor nível Top,De Hong Kong,,-1,0
142F FC71 com fio controlador gamepad lidar com botão Usb Para Console Nintendo Switch,Novo em folha,Vendedor nível Top,De Hong Kong,,-1,0
95E1 184C com fio controlador gamepad lidar com botão Usb Para Console Nintendo Switch,Novo em folha,Vendedor nível Top,De Hong Kong,,-1,0
"Nintendo Switch Console (cinza), Nintendo Switch-Nintendo Switch Frete Grátis!",Novo em folha,Vendedor nível Top,De Austrália,,-1,0
Controle Com Fio 6783 D133 Gamepad lidar com botão Usb Para Console Nintendo Switch,Novo em folha,Vendedor nível Top,De Hong Kong,,-1,0
877B F075 com fio controlador gamepad lidar com botão Usb Para Console Nintendo Switch,Novo em folha,Vendedor nível Top,De Hong Kong,,-1,0
F97D controlador gamepad com fio A315 lidar com botão Usb Para Console Nintendo Switch,Novo em folha,Vendedor nível Top,De Hong Kong,,-1,0
Controle Com Fio 0D93 C227 Gamepad lidar com botão Usb Para Console Nintendo Switch,Novo em folha,Vendedor nível Top,De Hong Kong,,-1,0
Bluetooth Sem Fio Pro controlador gamepad Alça Para Nintendo Switch Console Novo,Novo em folha,Vendedor nível Top,De China,,-1,0
Kit Nintendo Labo e Nintendo Switch console com pacote de Con Alegria,Novo em folha,Vendedor nível Top,De Estados Unidos,"R$ 1 790,95",-1,0
Nintendo Switch console Monster Hunter Xx Traição Especial Pack AT0225 F/S,Novo em folha,,De Japão,,5.0,5
Console Nintendo Switch splatoon 2 Edição JTK-4902370537338 Japão Novo,Novo em folha,,De Japão,,4.5,88
Tablet Nintendo Switch console somente-Muito Bom Estado,Seminovo,,De Reino Unido,,-1,0
Novo Sistema Console Nintendo Switch Super Mario Odyssey Conjunto Japonês Importado Do Japão,Novo em folha,Vendedor nível Top,De Japão,,5.0,1
Nintendo Switch Console Com Alegria-Con Cinza + Estojo Rígido + Protetor De Tela De Vidro,Novo em folha,,De Estados Unidos,"R$ 1 391,55",5.0,5
Nintendo Switch Console sistema Com Alegria-Controlador [Versão Japonesa] F/S,Novo em folha,Vendedor nível Top,De Japão,,-1,0
Novo Console Nintendo Switch splatoon 2 conjuntos Versão Japonesa Japão,Novo em folha,Vendedor nível Top,De Japão,,5.0,1085
Novo Console Nintendo Switch Com Cinza Joy-Con Deluxe Estojo de Viagem Pro Controller,Novo em folha,,De Estados Unidos,"R$ 1 920,32",5.0,1085
NINTENDO SWITCH CONSOLE WITH GREY JOY-CON EU GAME NEUF,Novo em folha,Vendedor nível Top,De Reino Unido,,NIN,0
Nintendo Switch Console Com Neon Red & Blue Joy-Con UE (importado Uk) Jogo Novo,Novo em folha,Vendedor nível Top,De Reino Unido,,-1,0
NINTENDO SWITCH CONSOLE WITH GREY JOY-CON EU GAME NUOVO,Novo em folha,Vendedor nível Top,De Reino Unido,,NIN,0
Saco De Armazenamento Eva Hard Case De Transporte Para Nintendo Switch Dock Console E Acessórios,Novo em folha,Vendedor nível Top,De China,,-1,0
Chave De Fenda 0.6Y 1.5+ Parafuso De Ferramentas De Reparo Para Console Nintendo Switch Alegria Con,Novo em folha,Vendedor nível Top,De China,,-1,0
NINTENDO SWITCH CONSOLE WITH NEON RED & BLUE JOY-CON EU GAME NUOVO,Novo em folha,Vendedor nível Top,De Reino Unido,,3.0,2
Sem fio controlador de jogo Gamepad Joystick Para Nintendo Switch Console Preto V4F4,Novo em folha,Vendedor nível Top,De Hong Kong,,Wir,0
Estojo Macio Preto Manga Capa Bolsa Saco armazenamento Para Console Nintendo Switch,Novo em folha,Vendedor nível Top,De China,,Pre,0
Cyber Gadget Nintendo Console Interruptor Gatilho Preto: 905 Grip,Novo em folha,Vendedor nível Top,De Japão,,Cyb,0
5C2F controlador gamepad com fio F3AB lidar com botão Usb Para Console Nintendo Switch,Novo em folha,Vendedor nível Top,De Hong Kong,,-1,0
Armazenamento portátil Saco Bolsa Capa Para Nintendo Switch console Joy V2I3,Novo em folha,Vendedor nível Top,De Hong Kong,,Por,0
EDF9 AF37 com fio controlador gamepad lidar com botão Usb Para Console Nintendo Switch,Novo em folha,Vendedor nível Top,De Hong Kong,,-1,0
Hot Taiko No Tatsujin Drum Set para Controlador Nintendo Switch console USB2.0,Novo em folha,Vendedor nível Top,De China,,-1,0
Saco para armazenagem ugreen Viagem Eva Hard Capa Para Carregar Nintendo Switch Console,Novo em folha,Vendedor nível Top,De Hong Kong,,-1,0
,Novo em folha,,De China,,-1,0
0EB9 com fio controlador gamepad lidar com botão Usb Para Console Nintendo Switch,Novo em folha,Vendedor nível Top,De Hong Kong,,-1,0
Super Mario armazenamento saco para viagem Nintendo Switch console carregar Capa Protetora,Novo em folha,Vendedor nível Top,De China,,-1,0
Para Nintendo Switch console pu Couro Capa Flip Protetor Suporte,Novo em folha,Vendedor nível Top,De China,,-1,0
Para Nintendo Switch console Clear 3D Película De Tela De Vidro Temperado Protetor De Guarda,Novo em folha,Vendedor nível Top,De China,,5.0,1
Controlador De Pro Wireless Gamepad Joypad Controle Remoto Para Nintendo Switch console Hv,Novo em folha,,De Malásia,,-1,0
Sem fio controlador de jogo Gamepad Joystick Para Nintendo Switch Console Preto Y4B9,Novo em folha,Vendedor nível Top,De Hong Kong,,Wir,0
Anti-shock Duro Protetor Bolsa Capa De Transporte Para Console Nintendo Switch,Novo em folha,Vendedor nível Top,De China,,-1,0
Anti-slip Silicone macio pele Protetor Caso Para Nintendo Switch Console Preto,Novo em folha,Vendedor nível Top,De Estados Unidos,"R$ 24,59",Pre,0
Teclado sem fio de jogo Gamepad Adaptador receptor de 2.4G Para Console Nintendo Switch,Novo em folha,Vendedor nível Top,De Hong Kong,,Pre,0
Mensageiro De Viagem Bolsa de armazenamento para carregar Nintendo Switch Console E Acessórios,Novo em folha,Vendedor nível Top,De China,,Pre,0
Nintendo Switch Console de alumínio metálico Estojo Protetor,Novo em folha,,De China,,-1,0
Controlador De Pro Wireless Gamepad Joypad Controle Remoto Para Nintendo Switch console Fo,Novo em folha,Vendedor nível Top,De China,,Wir,0
Capa TPU à prova de choque Protetor Capa Para Nintendo Switch console Acessório,Novo em folha,Vendedor nível Top,De China,,-1,0
Hot Taiko No Tatsujin Drum Set para Controlador Nintendo Switch console USB2.0,Novo em folha,Vendedor nível Top,De China,,-1,0
2X Wireless Pro Controller Joypad Gamepad Controle Remoto Para Console Nintendo Switch Novo,Novo em folha,Vendedor nível Top,De China,,-1,0
Controlador De Pro Wireless Gamepad Joypad Controle Remoto Para Nintendo Switch console Hot,Novo em folha,,De China,,-1,0
Saco para armazenagem ugreen Viagem Eva Hard Capa Para Carregar Nintendo Switch Console,Novo em folha,Vendedor nível Top,De Hong Kong,,-1,0
Zelda Sheikah Ardósia caso Saco Nintendo Switch Capa Protetora De Console,Novo em folha,Vendedor nível Top,De China,,-1,0
Hot Taiko No Tatsujin Drum Set para Controlador Nintendo Switch console USB2.0,Novo em folha,Vendedor nível Top,De China,,-1,0
Bolsa de armazenamento de viagem Estojo Bolsa De Transporte Para Acessórios Console Nintendo Switch,Novo (outro),Vendedor nível Top,De China,,-1,0
Taiko Tambor Baqueta controlador de jogo Gamepad Para Nintendo Switch Console,Novo em folha,Vendedor nível Top,De Hong Kong,,-1,0
Capa Protetora Tpu Impermeável Protetor De Manga Para Console Nintendo Switch Acessório,Novo em folha,Vendedor nível Top,De China,,-1,0
Nintendo Switch Console Preto Estojo de Viagem Bolsa De Transporte Com Protetor De Tela (novo),Novo em folha,,De Reino Unido,,Tem,0
Para Nintendo Switch console Cooler Ventilador de refrigeração Dock Base três ventiladores Dissipador De Calor,Novo em folha,Vendedor nível Top,De China,,-1,0
Protetor Macio Bolsa Estojo Case Para Carregar armazenamento Para Console Nintendo Switch,Novo em folha,Vendedor nível Top,De China,,Sof,0
Para Console Nintendo Switch Capa Protetora Dura Transparente Anti-scratch Escudo Protetor,Novo em folha,Vendedor nível Top,De China,,-1,0
Nintendo Switch console Joy-Con Anime Cartoon Garota Sexy ahegao Skins Adesivos,Novo em folha,,De China,,-1,0
Para Console Nintendo Switch Capa Protetora Dura Transparente Anti-scratch Escudo Protetor,Novo em folha,Vendedor nível Top,De China,,Pre,0
Protetor Rígido Bolsa Capa De Transporte Para Console Nintendo Switch Jogo-Preto,Novo em folha,Vendedor nível Top,De China,,5.0,4
Bolsa Estojo Rígido Com Alça Para Nintendo Switch console e acessórios de viagem Transporte,Novo em folha,Vendedor nível Top,De China,,-1,0
Absorção MoKo Shock-Capa protetora dura de cristal para Nintendo Switch console 2017,Novo em folha,Vendedor nível Top,De China,,-1,0
Anti-Slip Case Skin Capa Silicone Para Nintendo Switch Console/Joy-Con-Preto,Novo em folha,Vendedor nível Top,De China,,-1,0
Estojo Para Game Skins Adesivo decalques de vinil para Nintendo Switch Console + controlador 3!,Novo em folha,Vendedor nível Top,De China,,-1,0
Bolsa De Viagem tiracolo Mochila Para Console Nintendo Switch Joy-Con Acessórios,Novo em folha,,De China,,-1,0
Para Console Nintendo Switch Suporte Para Carro Banco Traseiro Suporte de Suporte para montagem de encosto de cabeça,Novo em folha,Vendedor nível Top,De China,,-1,0
Nintendo Switch console Joy-Con Dock Pele Super NES Retrô Snes decalques Vinil Pele,Novo em folha,,De China,,-1,0
Estojo macio saco bolsa De Transporte Eva de Proteção Capa Para Nintendo Switch Console,Novo em folha,Vendedor nível Top,De China,,-1,0
Borracha De Silicone Capa Protetora Para Console Nintendo Switch,Novo em folha,,De Reino Unido,,-1,0
Pele De Vinil Para Nintendo Switch (console Joy Con Interruptor Dock Joy-Con Grip),Novo em folha,Vendedor nível Top,De China,,-1,0
Capa Dura Snap Case Protetor Para Jogos De Console Nintendo Switch Tema Padrão,Novo em folha,Vendedor nível Top,De China,,-1,0
Slim Eva Hard Capa Protetora Para Viagem Saco Para Nintendo Switch Console E Acessórios,Novo em folha,Vendedor nível Top,De China,,-1,0
2Pcs Anti-slip Silicone Capa Para Nintendo Switch Console/Joy-Con Controle,Novo em folha,Vendedor nível Top,De China,,-1,0
MoKo Shock-absorção Anti-scratch Capa Para Nintendo Switch console 2017,Novo em folha,Vendedor nível Top,De China,,-1,0
"Protetora Tpu Transparente Estojo Macio, Capa Para Nintendo Switch console Joy Con",Novo em folha,Vendedor nível Top,De China,,-1,0
Cartucho para Nintendo Switch console Hard Estojo Porta-Saco Com 10 Jogo,Novo em folha,Vendedor nível Top,De China,,Pre,0
Capa De Couro P Stand titular Manga Saco Para Console Nintendo Switch & Joy-Con,Novo em folha,Vendedor nível Top,De China,,-1,0
Para Nintendo Switch console Cooler Ventilador de refrigeração Dock Base três ventiladores Dissipador De Calor,Novo em folha,Vendedor nível Top,De China,,-1,0
Clara Transparente Capa Protetora Macia Para Console Nintendo Switch Joy-con controlador,Novo em folha,Vendedor nível Top,De China,,-1,0
Capa Tpu Impermeável Capa Protetor Acessório Para Nintendo Switch Console,Novo em folha,Vendedor nível Top,De China,,-1,0
Estojo de Transporte Viagem Preto Caixa de armazenamento para Nintendo Switch Console E Acessórios,Novo em folha,Vendedor nível Top,De China,,Pre,0
Controlador De Pro Wireless Gamepad Joypad Controle Remoto Para Nintendo Switch console Yk,Novo em folha,,De Malásia,,-1,0
Para Nintendo Switch console Cooler Ventilador de refrigeração Dock Base três ventiladores Dissipador De Calor,Novo em folha,,De China,,-1,0
Protetor De Luxo Super Mario Carry caso Nintendo Switch console Presente De Natal,Novo em folha,,De China,,-1,0
12 Em 1 Porta-cartão De Memória Estojo de Capa Cartão De Jogo Para Console Nintendo Switch,Novo em folha,Vendedor nível Top,De China,,-1,0
"Estojo de transporte com zíper bolsa com alça para Nintendo Switch console Joy-con, Blac Zc",Novo em folha,Vendedor nível Top,De Hong Kong,,Zip,0
Capa resistente à prova de choque Nintendo Switch console Mala Protetora Presente De Natal,Novo em folha,,De China,,-1,0
Anti-slip Silicone Capa Case Kit Para Nintendo Switch console joysticks,Novo em folha,Vendedor nível Top,De China,,Pre,0
Armazenamento de viagem bolsa de ombro mensageiro para Nintendo Switch Console E Acessórios,Novo em folha,Vendedor nível Top,De China,,-1,0
Conjunto de Estojo de estrutura de substituição para Console Nintendo Switch Joy-con controlador,Novo em folha,Vendedor nível Top,De China,,-1,0
Estojo De Transporte Eva Sacola tipo tote de armazenamento para Nintendo Switch Console E Acessórios,Novo em folha,Vendedor nível Top,De China,,-1,0
Revestimento Adesivo Para Nintendo Switch Super Famicom Edition design console Joy-Cons,Novo em folha,Vendedor nível Top,De Coreia do Sul,,-1,0
12 Em 1 slots de 12+2 Cartas De Jogo Estojo Rígido Caixa de armazenamento para Console Nintendo Switch,Novo em folha,Vendedor nível Top,De China,,-1,0
Pele Nintendo Switch console Anime Cartoon Garota Sexy ahegao decalques adesivos de pele,Novo em folha,Vendedor nível Top,De China,,-1,0
Baona Preto Slim Eva Estojo rígido Capa para Nintendo Switch Console E Acessórios,Novo em folha,,De China,,Bao,0
Suporte Para Carro De Volta Holder Suporte Para Nintendo Switch console assento Encosto De Cabeça Mount,Novo em folha,Vendedor nível Top,De China,,-1,0
Nintendo Switch console Joy-Con pele Anime Kingdom Hearts Vinil decalques adesivos,Novo em folha,Vendedor nível Top,De China,,-1,0
Case Skin De Borracha De Silicone Gel Capa Grip para Nintendo Switch console Joy-Con,Novo em folha,Vendedor nível Top,De Hong Kong,,-1,0
Capa Protetora Macia De Poeira armazenamento saco bolsa de transporte F. Nintendo Switch Console,Novo em folha,Vendedor nível Top,De China,,Pre,0
Para Nintendo Switch Console e Acessórios Carry Case Capa Dura Pc armazenamento de saco,Novo em folha,Vendedor nível Top,De Hong Kong,,For,0
Tipo de porta de carregamento de substituição-C Carregador Soquete Para Nintendo Switch Console,Novo em folha,Vendedor nível Top,De China,,-1,0
Protetor Portable Hard carregar Bolsa Estojo de armazenamento para Console Nintendo Switch Jf #E,Novo em folha,Vendedor nível Top,De China,,-1,0
Saco de armazenamento EVA à prova de choque resistente Travel Case para carregar Para Console Nintendo Switch,Novo em folha,Vendedor nível Top,De China,,Pre,0
